{
  "$schema": "../schemas/g5_workload_v1.schema.json",
  "schema_version": "1.0",
  "xlen": 32,
  "iterations": 64,
  "layout_catalog_sha256": "7ad9fd792edf60d848fac03c27ae95bd9023b683b0c769f28e5d3dfb8f4afd70",
  "semantic_catalog_sha256": "fbadcad47d75a3b5b54a7c3a62066888cdfa342b5f1498ebfee4e5435e98f3f0",
  "profiles": [
    {"id": "P0", "kind": "control", "semantic_id": null, "layout_id": null, "backend": "NONE", "execution_status": "runnable", "measurement_modes": ["latency"], "inputs": [17, 29], "source_registers": [], "destination_registers": [], "immediate": null, "instruction_encoding": null, "throughput_instruction_encodings": [], "expected_results": [46], "expected_ci_retired": 0},
    {"id": "P1", "kind": "semantic", "semantic_id": 0, "layout_id": 0, "backend": "AUTOISA_CVXIF_NATIVE", "execution_status": "runnable", "measurement_modes": ["latency", "throughput"], "inputs": [17, 29], "source_registers": [8, 9], "destination_registers": [10], "immediate": null, "instruction_encoding": "0x0094055b", "throughput_instruction_encodings": ["0x0094055b", "0x009405db", "0x0094065b", "0x009406db"], "expected_results": [46, 0], "expected_ci_retired": 64},
    {"id": "P2", "kind": "semantic", "semantic_id": 1, "layout_id": 1, "backend": "AUTOISA_CVXIF_NATIVE", "execution_status": "runnable", "measurement_modes": ["latency", "throughput"], "inputs": [6, 7, 8], "source_registers": [8, 9, 10], "destination_registers": [11], "immediate": null, "instruction_encoding": "0x549415db", "throughput_instruction_encodings": ["0x549415db", "0x5494165b", "0x549416db", "0x5494175b"], "expected_results": [50, 0], "expected_ci_retired": 64},
    {"id": "P3", "kind": "semantic", "semantic_id": 2, "layout_id": 2, "backend": "AUTOISA_DIRECT_CI_EXTENDED", "execution_status": "build_only", "measurement_modes": ["latency"], "inputs": [3, 5, 7, 11], "source_registers": [8, 9, 10, 11], "destination_registers": [12], "immediate": null, "instruction_encoding": "0x1344285b", "throughput_instruction_encodings": [], "expected_results": [29, 0], "expected_ci_retired": 64},
    {"id": "P4", "kind": "semantic", "semantic_id": 3, "layout_id": 3, "backend": "AUTOISA_DIRECT_CI_EXTENDED", "execution_status": "build_only", "measurement_modes": ["latency"], "inputs": [21, 8], "source_registers": [8, 9], "destination_registers": [10, 11], "immediate": null, "instruction_encoding": "0x0694355b", "throughput_instruction_encodings": [], "expected_results": [29, 13], "expected_ci_retired": 64},
    {"id": "P5", "kind": "semantic", "semantic_id": 4, "layout_id": 4, "backend": "AUTOISA_DIRECT_CI_EXTENDED", "execution_status": "build_only", "measurement_modes": ["latency"], "inputs": [2, 3, 5, 7], "source_registers": [8, 9, 10, 11], "destination_registers": [12, 13], "immediate": null, "instruction_encoding": "0x2b44425b", "throughput_instruction_encodings": [], "expected_results": [4294967285, 29], "expected_ci_retired": 64},
    {"id": "P6", "kind": "semantic", "semantic_id": 5, "layout_id": 5, "backend": "AUTOISA_DIRECT_CI_EXTENDED", "execution_status": "build_only", "measurement_modes": ["latency"], "inputs": [1, 2, 3, 4, 5, 6], "source_registers": [8, 9, 10, 11, 12, 13], "destination_registers": [14], "immediate": null, "instruction_encoding": "0x0b1a232b", "throughput_instruction_encodings": [], "expected_results": [21, 0], "expected_ci_retired": 64},
    {"id": "P7", "kind": "semantic", "semantic_id": 6, "layout_id": 6, "backend": "AUTOISA_DIRECT_CI_EXTENDED", "execution_status": "build_only", "measurement_modes": ["latency"], "inputs": [2, 3, 4, 5, 6, 7], "source_registers": [8, 9, 10, 11, 12, 13], "destination_registers": [14, 15], "immediate": null, "instruction_encoding": "0x58d11f7b", "throughput_instruction_encodings": [], "expected_results": [68, 28], "expected_ci_retired": 64},
    {"id": "P8", "kind": "semantic", "semantic_id": 7, "layout_id": 7, "backend": "AUTOISA_CVXIF_NATIVE", "execution_status": "runnable", "measurement_modes": ["latency", "throughput"], "inputs": [5, 9], "source_registers": [8, 9], "destination_registers": [10], "immediate": 3, "instruction_encoding": "0x0094350b", "throughput_instruction_encodings": ["0x0094350b", "0x0094358b", "0x0094360b", "0x0094368b"], "expected_results": [36, 0], "expected_ci_retired": 64}
  ]
}
